209045200,"MASCARILLA RECTANGULAR DESECHABLE CUATRO TIRAS , CON O SIN VISOR.                      (SE SOLICITA  SIN VISOR TAMA•O ADULTO)",0.09 ,0 ,0 ,0 ,0,0.00,,
209045301,"CONECTOR PARA ADMINISTRACION DE SOLUCION INTRAVENOSA CON BURETA (MICROGOTERO) (SE SOLICITA SITIO DE INYECCION CON MENBRANA  Y SITIO EN""Y""  LIBRE DE AGUJA) (SOLICITAMOS LIBRE DE AGUJA.)
",2.31 ,400 ,0 ,0 ,400,922.00,,
209045304,MICRONEBULIZADOR CON MASCARA           (SE SOLICITA TAMA•O PEDIµTRICO),0.40 ,"34,800 ","3,700 ","7,100 ","45,600","18,406.44",,
209045306,MICRONEBULIZADOR CON MASCARA.          (SE SOLICITA TAMA•O ADULTO),0.41 ,100 ,"4,800 ","7,800 ","12,700","5,263.52",,
209045502,ALGOD‡N EN MOTAS (Se solicita mota de 0.7gr) ,0.01 ,"31,596,000 ","905,000 ","1,482,000 ","33,983,000","169,915.00",,
209046111,"PA•AL DESECHABLE PARA RECIEN NACIDO HASTA 5 LIBRAS (2.27Kg)                                                                                                                                                                                                                                                         
",0.22 ,0 ,0 ,0 ,0,0.00,,
209046112,"PA•AL DESECHABLE PARA ADULTO                 (SE SOLICITA TAMA•O DE CINTURA 45"" A  58"" ( 114.3 CM A 147.32 CM)DE TELA NO TEJIDA)",0.41 ,60 ,0 ,0 ,60,24.30,,
209046113,PA•AL DESECHABLE PARA NI•O.                                           (SE SOLICITA  PESO DE 6 LBS A 14 LBS),0.25 ,0 ,0 ,0 ,0,0.00,,
209046114,PA•AL DESECHABLE PARA NI•O  SE SOLICITA PESO DE 12 A 24 LBS.                                                                                                                                                                                                                                                      ,0.31 ,0 ,0 ,0 ,0,0.00,,
209046700,"PAPEL PARA ESTERILIZAR GRADO MêDICO (MINIMO DE 60 GRAMOS POR METRO CUADRADO),                  (SE SOLICITA DE 8"" X 8"" (20 CMS X 20 CMS).",0.03 ,0 ,0 ,0 ,0,0.00,,
209046701,"PAPEL PARA ESTERILIZAR GRADO MêDICO (MINIMO DE 60 GRAMOS POR METRO CUADRADO) SE SOLICITA DE 12"" X  12"" (30 CMS X 30 CMS)",0.06 ,0 ,0 ,0 ,0,0.00,,
209046704,"PAPEL PARA ESTERILIZAR GRADO MêDICO (MINIMO 60 GRAMOS POR METRO CUADRADO), SE SOLICITA DE 16"" X  16"" (40 CMS X 40 CMS)",0.04 ,0 ,0 ,0 ,0,0.00,,
209046705,"PAPEL PARA ESTERILIZAR GRADO MêDICO (MINIMO 60 GRAMOS POR METRO CUADRADO),  SE SOLICITA 18"" X 18"" (46 CMS. X 46 CMS.)",0.08 ,0 ,0 ,0 ,0,0.00,,
209046707,"PAPEL PARA ESTERILIZAR GRADO MêDICO (MINIMO DE 60 GRAMOS POR METRO CUADRADO),             (SE SOLICITA DE 24"" X 24"" 60 CMS. X 60 CMS.)",0.12 ,0 ,0 ,0 ,0,0.00,,
209046709,"PAPEL PARA ESTERILIZAR GRADO MêDICO (M÷NIMO 60 GRAMOS POR METRO CUADRADO),  SOLICITAMOS 30"" X 30"" (75 CMS. 75 CMS).",0.22 ,0 ,0 ,0 ,0,0.00,,
209047500,"PINZA DE AGARRE LAPAROSCOPICA CON DIENTE, 5MM DESECHABLE",60.54 ,0 ,78 ,0 ,78,"4,722.12",,
209047501,"INSTRUMENTO PARA LIGAR VASOS DE TITANIUM, DESECHABLE  (SE SOLICITA TAMA•O GRANDE)",94.54 ,0 ,270 ,100 ,370,"34,979.80",,
209047502,"INSTRUMENTO PARA LIGAR VASOS DE TITANIUM, DESECHABLE  (SE SOLICITA TAMA•O MEDIANO)",60.89 ,0 ,0 ,0 ,0,0.00,,
209047600,PLACA PARA IMPRESI‡N PLANTAR,1.15 ,0 ,0 ,0 ,0,0.00,,
209048600,"SISTEMA CERRADO PARA DRENAJE DE FLUIDOS CONTINUOS. SE SOLICITA DE 19FR.,  DE SILICONA RESERVORIO 400CC A 450CC",33.69 ,0 ,0 ,0 ,0,0.00,,
209048901, SISTEMA PARA ASPIRACION DE MUESTRA DE MUCOSIDADES (TRAMPA),1.05 ,"13,700 ",400 ,"1,750 ","15,850","16,667.86",,
209049500,JUEGO DE BOLSA DESECHABLE PARA CADµVER,6.93 ,"44,025 ",125 ,725 ,"44,875","310,983.75",,
209049600,CONECTOR LIBRE DE AGUJAS PARA ACCESOS VASCULARES VENOSOS,1.74 ,0 ,0 ,0 ,0,0.00,,
209049700,SET DESECHABLE PARA REMOVER PUNTOS DE SUTURAS. SE SOLICITA PINZA DE METAL,1.77 ,0 ,0 ,0 ,0,0.00,,
209049704,"SISTEMA DE CATêTER URETERAL DOBLE J, PARA ADULTO.                    (SE SOLICITA DIAMETRO DE 6FR)",132.50 ,0 ,0 ,0 ,0,0.00,,
209049800,"BANDEJA PARA PREPARACI‡N Y RASURADO DE LA PIEL
DESECHABLE PARA LA PREPARACION Y RASURADO DE LA PIEL, COMPUESTO POR: 1- BANDEJA PL∑STICA CON COMPARTIMIENTOS. 2- UNA MAQUINA DE RASURAR CON SU HOJA. 3- GASA 4"" X 4"". 4- CON SOLUCION JABONOSA DE BETHADINE. 5- DOS (2) APLICADORES DE 3"" CON PUNTA DE ALGOD„N. 6- DOS (2)TOALLAS PARA LA LIMPIEZA.BANDEJA PARA PREPARACION Y RASURADO DE LA PIEL.",1.29 ,0 ,0 ,0 ,0,0.00,,
209049802,RECIPIENTE PARA SUCCION  SE SOLICITA Con v†lvulas de cierre,2.74 ,200 ,100 ,"2,000 ","2,300","6,290.50",,
209049803,"RECIPIENTE PARA SUCCION      SE SOLICITA Con v†lvulas de cierre -Capacidad De  2000 A 3000 cc DEBE ENTREGAR LOS EQUIPOS Y CONECTORES NECESARIOS PARA SU UTILIZACION, MINIMO 300 UNIDADES O SER COMPATIBLE CON EQUIPO EN LA INSTITUCION ADJUDICACION GLOBAL CON EL RENGLON 367",2.77 ,"10,605 ",0 ,0 ,"10,605","29,375.85",,
209050104,SISTEMA DE SUCCION E IRRIGACION LAPAROSCOPICA CON ESPATULA,54.97 ,"12,460 ",60 ,50 ,"12,570","690,935.19",,
209051000,SONDA LISA DE CAUCHO BLANDO ROJO PARA CATETERISMO URETRAL. SE SOLICITA TAMA•O 8 FR,0.40 ,0 ,0 ,0 ,0,0.00,,
209051001,SONDA LISA DE CAUCHO BLANDO ROJO PARA CATETERISMO URETRAL. (SE SOLICITA TAMA•O 10 FR),0.40 ,0 ,"2,750 ","2,600 ","5,350","2,122.88",,
209051002,SONDA LISA DE CAUCHO BLANDO ROJO PARA CATETERISMO URETRAL. (SE SOLICITA TAMA•O 12 FR),0.44 ,0 ,"2,500 ",0 ,"2,500","1,087.50",,
209051003,SONDA LISA DE CAUCHO BLANDO ROJO PARA CATETERISMO URETRAL. (SE SOLICITA TAMA•O 14 FR),0.39 ,0 ,150 ,0 ,150,58.08,,
209051004,SONDA LISA DE CAUCHO BLANDO ROJO PARA CATETERISMO URETRAL. SE SOLICITA  TAMA•O 16FR,0.64 ,"16,300 ","6,880 ","1,200 ","24,380","15,481.30",,
209051005,SONDA LISA DE CAUCHO BLANDO ROJO PARA CATETERISMO URETRAL. (SE SOLICITA TAMA•O 18 FR),0.42 ,0 ,0 ,0 ,0,0.00,,
209051201,"CATETER DE SUCCION NASO-FARINGEA . SE SOLICITA, CALIBRE 8FR DE 35CM DE LONGITD, CON GRADUACION Y PRESENTACION LONGITUDINAL.
",0.99 ,0 ,0 ,0 ,0,0.00,,
209051300,"CATETER DE SUCCION NASO-FARINGEA . SE SOLICITA, CALIBRE 10FR DE 45CM DE LONGITD, CON GRADUACION Y PRESENTACION LONGITUDINAL.

",0.72 ,0 ,0 ,0 ,0,0.00,,
209051301,"CATETER DE SUCCION NASO-FARINGEA. (SE SOICITA, CALIIBRE 12FR DE 45CM DE LONGITD, CON GRADUACION Y PRESENTACION LONGITUDINAL.)",0.45 ,0 ,0 ,0 ,0,0.00,,
209051302,"CATETER DE SUCCION NASO-FARINGEA . SE SOLICITA, CALIBRE 14FR DE 45CM DE LONGITUD, CON GRADUACION Y PRESENTACION LONGITUDINAL.

",0.59 ,0 ,0 ,0 ,0,0.00,,
209051303,"CATETER DE SUCCION NASO-FARINGEA. (SE SOLICITA, CALIBRE 16FR DE 45CM DE LONGITD, CON GRADUACION Y PRESENTACION LONGITUDINAL.)",0.59 ,0 ,0 ,0 ,0,0.00,,
209051304,"CATETER DE SUCCION NASO-FARINGEA SE SOLICITA CALIBRE 18Fr,45cm DE LONGITUD CON GRADUACION Y PRESENTACION LONGITUDINAL
",0.74 ,0 ,0 ,0 ,0,0.00,,
209051901,"MALLA HEMOSTATICA  (SE SOLICITA TIPO MALLA 2"" X 14"", 5CM X 35CM)                                                                                                                                                                                                                                                                                                                            ",22.25 ,0 ,0 ,0 ,0,0.00,,
209051902,"MALLA HEMOSTATICA       SE SOLICITA  TIPO MALLA 4"" X 8"", 10CM X 20CM",31.94 ,0 ,0 ,0 ,0,0.00,,
209051903,MALLA HEMOSTATICA (SE SOLICITA TIPO TELA DE 7.5 CM X 10.2CM DE LARGO).,72.17 ,0 ,0 ,0 ,0,0.00,,
209051906,MALLA QUIRURGICA TRIDIMENSIONAL PARA REFORZAR PLANOS ANATOMICOS  SE SOLICITA  4.5CM X 7.5CM                                                                                                                                                                                                                      ,194.12 ,0 ,0 ,0 ,0,0.00,,
209051907,MALLA QUIRURGICA TRIDIMENSIONAL PARA REFORZAR PLANOS ANATOMICOS  (SE SOLICITA 4.5CMS X 10CM  (BASE DE 10CMS TAMA•O GRANDE)                                                                                                                                                                                                                      ,206.11 ,0 ,0 ,0 ,0,0.00,,
209052001,MALLA EXPANDIBLE TUBULAR            (SE SOLICITA TAMA•O 1),3.62 ,0 ,385 ,95 ,480,"1,738.81",,
209052002, MALLA EXPANDIBLE TUBULAR. SE SOLICITA  TAMA•O 2 CON CODIFICACI‡N DE COLORES. ,3.13 ,0 ,100 ,0 ,100,313.00,,
209052004," MALLA EXPANDIBLE TUBULAR.  SE SOLICITA TAMA•O 4, SIN CODIFICADOR DE COLORES.",5.39 ,0 ,673 ,0 ,673,"3,624.11",,
209052005,MALLA EXPANDIBLE TUBULAR.           (SE SOLICITA TAMA•O 5),6.89 ,0 ,0 ,0 ,0,0.00,,
209052006, MALLA EXPANDIBLE TUBULAR.  SE SOLICITA TAMA•O 6,6.99 ,0 ,0 ,0 ,0,0.00,,
209052007,MALLA EXPANDIBLE TUBULAR.  SE SOLICITA TAMA•O 7,8.68 ,0 ,0 ,0 ,0,0.00,,
209052008,MALLA EXPANDIBLE TUBULAR.   (SE SOLICITA TAMA•O 8 SIN CODIFICADOR DE COLORES),9.28 ,"31,676 ",428 ,96 ,"32,200","298,819.86",,
209052009,MALLA EXPANDIBLE TUBULAR. SE SOLICITA TAMA•O 9 SIN CODIFICADOR DE COLORES.,16.23 ,"1,044 ","1,160 ",345 ,"2,549","41,357.53",,
209052102,"FêRULA CERVICAL PARA CUELLO DE DOS PIEZAS, TIPO PHILADELPHIA CIRCUNFERENCIA: PEQUE•O DE 10"" A 13"". ALTURA: DE 2¨ A 3¨",10.82 ,395 ,0 ,0 ,395,"4,275.55",,
209052103,"FêRULA CERVICAL PARA CUELLO DE DOS PIEZAS, TIPO PHILADELPHIA, CIRCUNFERENCIA: MEDIANO DE 13"" A 16"". ALTURA: DE 2¨ A 4¨",20.00 ,0 ,0 ,0 ,0,0.00,,
209052104,"FêRULA CERVICAL PARA CUELLO DE DOS PIEZAS, TIPO PHILADELPHIA (Se solicita circunferencia grande de  16"" a 19"", altura de 1´"" a 5¨"")                                                                                                   ",14.11 ,765 ,50 ,10 ,825,"11,640.75",,
209052502,TAPON HEPARINIZADO PARA CANULA INTRAVENOSA. Para el cierre temporal de c†nula intravenosa y administraci¢n de medicamentos a intervalos regulares.(Se Solicita con membrana de l†tex y con Con conexi¢n de rosca (luer lock).,0.17 ,0 ,0 ,0 ,0,0.00,,
209052801,TIJERA CURVA PARA CIRUGIA LAPAROSC‡PICA. ,34.22 ,0 ,60 ,0 ,60,"2,053.20",,
209053500,TUBO UNIVERSAL DE PLASTICO.  SE SOLICITA DE 6 MM. (1/4 DE PULGADA) DE LONGITUD DE 30 MT. (100PIES),9.93 ,120 ,0 ,0 ,120,"1,191.00",,
209054600,"TUBO NASOGASTRICA TIPO LEVIN .SOLICITAMOS TAMA•O 8 FR, LONG 120CM.
",1.12 ,0 ,0 ,0 ,0,0.00,,
209054601,"TUBO NASOGASTRICA TIPO LEVIN. SOLICITAMOS TAMA•O 10FR, LONG 120CM
",0.62 ,950 ,600 ,580 ,"2,130","1,309.95",,
209054602,"TUBO NASOGASTRICA TIPO LEVIN. SOLICITAMOS TAMA•O 12 FR, LONG 120CM
",0.98 ,600 ,490 ,610 ,"1,700","1,657.50",,
209054603,"TUBO NASOGASTRICA TIPO LEVIN (SOLICITAMOS TAMA•O 14FR, LONG 120CM)",0.92 ,"6,400 ",150 ,280 ,"6,830","6,283.60",,
209054700,"TUBO NASOGASTRICA TIPO LEVIN. SOLICITAMOS TAMA•O 18 FR, LONG 120CM",1.05 ,"2,300 ",340 ,"1,150 ","3,790","3,960.55",,
209054800,"TUBO NASOGµSTRICO TIPO LEVIN (Se solicita de 16 FR, longitud 120cm)  
",0.96 ,"1,700 ",0 ,"1,150 ","2,850","2,721.75",,
209055601,TUBO ENDOTRAQUEAL CON BALON            (SE SOLICITA TAMA•O DE 7MM),0.51 ,"128,150 ","1,640 ","1,270 ","131,060","67,233.78",,
209055602,TUBO ENDOTRAQUEAL CON BALON. SE SOLICITA TAMA•O DE 7.5MM,0.51 ,"63,900 ","1,600 ",880 ,"66,380","34,052.94",,
209055603,TUBO ENDOTRAQUEAL CON BALON             (SE SOLICITA TAMA•O DE 8MM),0.51 ,"98,800 ",700 ,920 ,"100,420","51,515.46",,
209055604,TUBO ENDOTRAQUEAL CON BALON.                                      (SE SOLICITA TAMA•O DE 8.5MM),0.51 ,0 ,"1,050 ",0 ,"1,050",538.65,,
209055901,CANÈLA DE TRAQUEOSTOM÷A. SE SOLICITA TAMA•O N¯ 8,46.25 ,153 ,51 ,178 ,382,"17,667.50",,
209055904,CANÈLA DE TRAQUEOSTOM÷A.                      (SE SOLICITA TAMA•O N¯ 6),39.99 ,0 ,340 ,12 ,352,"14,076.48",,
209056301,CµNULA OROFARINGEA TIPO BERMAN (SE SOLICITA DE 90MM ADULTO).,232.00 ,"12,900 ","3,800 ",0 ,"16,700","3,874,400.00",,
209056302,CANULA OROFARINGEA TIPO BERMAN. SE SOLICITA N¯10 (100MM) ADULTO,0.53 ,0 ,0 ,0 ,0,0.00,,
209056400,"SONDA O TUBO PARA ALIMENTACI‡N ENTERAL DE 5 FR A 20FR, Se solicita calibre 5FR y 38cm de longitud CON TAPON INCORPORADO
",1.72 ,0 ,0 ,0 ,0,0.00,,
209056500,SONDA O TUBO PARA ALIMENTACION ENTERAL DE 5 FR A 20FR.        (SE SOLICITA CALIBRE 8 FR Y 38CM DE LONGITUD),0.55 ,"40,750 ",200 ,200 ,"41,150","22,632.50",,
209056700,"TUBOS DE DRENAJE TIPO PENROSE. SE SOLICITA 1/4"" 6.35MM x 45.7 CM",0.97 ,370 ,0 ,180 ,550,532.40,,
209056702,"TUBO DE DRENAJE TIPO PEMROSE. SE SOLICITA DE:  1/2"" (12.70MM)  X 12"" (30.5CM)  DE LONGITUD",1.50 ,0 ,0 ,0 ,0,0.00,,
209056800,CANULA NASAL PARA ADMINISTRAR OXIGENO (SE SOLICITA TAMA•O ADULTO),0.86 ,0 ,0 ,0 ,0,0.00,,
209056801,CANULA NASAL PARA ADMINISTRAR OXIGENO. SE SOLICITA: TAMA•O PEDIATRICO,0.18 ,0 ,340 ,0 ,340,60.13,,
209057600,VASO PLµSTICO DESECHABLE  PARA MEDICAMENTO (SE SOLICITA SIN TAPA),0.03 ,"2,335,000 ","148,700 ","203,900 ","2,687,600","77,940.40",,
209057702,"VENDA ABDOMINAL QUIRÈRGICA . SE SOLICITA  TAMA•O 18 X 18"" PULGADAS.                                                                                                                                                                                                                          
Venda abdominal de gasa prelavada, EstÇril De 8˘ a 18"" x 18""a 36˘ Malla de 20 a 24 x 28 hilos, Cuatro a seis(4-6) dobleces. Con elemento radio-opaco. LA INSTITUCION SOLICITARA EL TAMA•O REQUERIDO.",0.40 ,"163,000 ","39,800 ","19,200 ","222,000","87,690.00",,
209057800,"VENDA AJUSTABLE DE GASA ABSORBENTE DE 1 A 2 DOBLECES (Se solicita de 1"") ",0.16 ,0 ,0 ,0 ,0,0.00,,
209057801,"VENDA AJUSTABLE DE GASA ABSORBENTE DE 1 A 2 DOBLECES. SE SOLICITA TAMA•O DE  2""",0.08 ,0 ,0 ,0 ,0,0.00,,
209057802,"VENDA AJUSTABLE DE GASA ABSORBENTE DE 1 A 2 DOBLECES. SE  SOLICITA  TAMA•O DE  3""",0.12 ,0 ,0 ,0 ,0,0.00,,
209057803,"VENDA AJUSTABLE DE GASA ABSORBENTE DE 1 A 2 DOBLECES. SE  SOLICITA TAMA•O DE  4""",0.14 ,0 ,0 ,0 ,0,0.00,,
209058002,"VENDA DE GASA SIMPLE 1 A 4"" DE ANCHO                                                                                                                                                                                                              ",0.24 ,0 ,0 ,0 ,0,0.00,,
209058003,"VENDA DE GASA SIMPLE  (Se solicita de 4"" de ancho y 10yds de longitud). ",0.60 ,0 ,0 ,0 ,0,0.00,,
209058100,"VENDA ELASTICA  SE SOLICITA 2"" DE ANCHO X 5"" YARDAS DE LONGITUD                                                                                                                                                                                                                                                                            ",0.65 ,0 ,0 ,0 ,0,0.00,,
209058101,"VENDA ELASTICA  SE SOLICITA 3"" DE ANCHO X 5"" YARDAS DE LONGITUD                                                                                                                                                                                                                                                                               ",0.26 ,0 ,0 ,0 ,0,0.00,,
209058102,"VENDA ELASTICA  SE SOLICITA 4"" DE ANCHO X 5"" YARDAS DE LONGITUD                                                                                                                                                                                                                                                                               ",1.34 ,0 ,0 ,0 ,0,0.00,,
209058103,"VENDA ELASTICA  SE SOLICITA 6"" DE ANCHO X 5"" YARDAS DE LONGITUD                                                                                                                                                                                                                                                                               ",0.69 ,0 ,0 ,0 ,0,0.00,,
209058300,"VENDA DE YESO     (SE SOLICITA DE FRAGUADO RµPIDO DE 3"" X 3 YARDAS, DE MAXIMO DE 5 MINUTOS)",1.08 ,0 ,"1,440 ",0 ,"1,440","1,555.20",,
209058301,"VENDA DE YESO . SE SOLICITA DE FRAGUADO RµPIDO MAXIMO DE 5 MINUTOS DE 4"" X 3 YARDAS",2.02 ,0 ,0 ,0 ,0,0.00,,
209058302,"VENDA DE YESO, SE SOLICITA DE FRAGUADO RµPIDO MAXIMO DE 5 MINUTOS DE  4"" X 5 YARDAS.",2.06 ,0 ,0 ,0 ,0,0.00,,
209058303,"VENDA DE YESO  SE SOLICITA DE FRAGUADO RµPIDO MAXIMO DE 5 MINUTOS DE 5"" X 5 YARDAS",2.45 ,0 ,"4,408 ",125 ,"4,533","11,105.85",,
209058304,"VENDA DE YESO, SE SOLICITA DE FRAGUADO RµPIDO MAXIMO DE 5 MINUTOS DE 6"" X 5 YARDAS.",3.53 ,"8,928 ",0 ,816 ,"9,744","34,396.32",,
209058306,"VENDA DE YESO, SE SOLICITA DE FRAGUADO RµPIDO MAXIMO DE  5 MINUTOS DE  8"" X 5 YARDAS.",3.49 ,0 ,"2,060 ",480 ,"2,540","8,864.60",,
209058400,"VENDA DE GASA ABSORBENTE AJUSTABLE,  6 DOBLECES",0.76 ,0 ,0 ,0 ,0,0.00,,
209058900,"SUTURA CATGUT CR‡MICO, CALIBRE 0, LONGITUD 67 A 75 CM.  AGUJA DE 35 A 37MM, DELGADA, ´ ÷IRCULO, PUNTA REDONDA. ",1.14 ,"74,040 ","16,224 ",792 ,"91,056","103,348.56",,
209059200,"SUTURA: CATGUT CR‡MICO, CALIBRE 1",1.30 ,0 ,0 ,0 ,0,0.00,,
209059300,"SUTURA: CATGUT CR‡MICO, (SE SOLICITA CALIBRE 1)",0.82 ,0 ,0 ,0 ,0,0.00,,
209059400,"SUTURA: CATGUT CR‡MICO, CALIBRE 1, LONGITUD 75 CM,  AGUJA DE  37 MM, GRUESA, ´ C÷RCULO, PUNTA REDONDA GRUESA. ",1.21 ,"7,056 ",336 ,576 ,"7,968","9,641.28",,
209059700,"SUTURA: CATGUT CR‡MICO, CALIBRE 2-0",1.40 ,0 ,0 ,0 ,0,0.00,,
209059800,"SUTURA: CATGUT CR‡MICO CALIBRE  2-0,  SE SOLICITA DE LONGITUD DE 75 CM CON AGUJA DE 37 MM PUNTA REDONDA DELGADA",0.95 ,0 ,0 ,0 ,0,0.00,,
209059901,"SUTURA: CATGUT SIMPLE, CALIBRE 2-0, LONGITUD 67 A 75cm, AGUJA DE 20 A 22mm, ´ C÷RCULO, PUNTA REDONDA ESTêRIL ",1.39 ,0 ,0 ,0 ,0,0.00,,
209060000,"SUTURA: CATGUT CR‡MICO, CALIBRE 3-0",1.70 ,0 ,0 ,0 ,0,0.00,,
209060300,"SUTURA: CATGUT CROMICO, CALIBRE 4-0",0.73 ,"7,308 ",216 ,552 ,"8,076","5,908.24",,
209060500,"SUTURA: CATGUT CR‡MICO, CALIBRE  5-0, LONGITUD 45 CM. AGUJA DE 12 o 13 MM., ? C÷RCULO, PUNTA CORTANTE ESTêRIL. ",1.12 ,"4,440 ","1,848 ",564 ,"6,852","7,674.24",,
209062502,"SUTURA: POLIPROPILENO MONOFILAMENTO AZUL, CALIBRE 0",0.87 ,0 ,0 ,0 ,0,0.00,,
209062504,"SUTURA: POLIPROPILENO MONOFILAMENTO AZUL, CALIBRE 2-0, AGUJA REDONDA LONGITUD 75 A 90 CM. AGUJA DOBLE DE 25 A 26 MM., ´ C÷RCULO, PUNTA REDONDA ESTêRIL. ",1.18 ,"3,720 ","1,008 ",576 ,"5,304","6,258.72",,
209062506,"SUTURA DE POLIPROPILENO MONOFILAMENTO AZUL,CALIBRE1",0.93 ,0 ,"6,168 ",0 ,"6,168","5,745.62",,
209062602,"SUTURA: NYLON MONOFILAMENTO, CALIBRE 3-0",0.51 ,0 ,0 ,0 ,0,0.00,,
209062701,"SUTURA NYLON MONOFILAMENTO, CALIBRE 3-0 Con longitud 75 cm. con aguja de 24 mm., 3/8 circulo, punta cortantes reverso estÇril.",0.47 ,0 ,0 ,0 ,0,0.00,,
209062704,"SUTURA: NYLON MONOFILAMENTO, CALIBRE 4-0",0.50 ,0 ,0 ,0 ,0,0.00,,
209062902,SUTURA NYLON MONOFILAMENTO CALIBRE 10-0.      ,5.98 ,0 ,0 ,0 ,0,0.00,,
209063300,"SUTURA: NYLON MONOFILAMENTO, SE SOLICITA CALIBRE 6-0",1.25 ,0 ,0 ,0 ,0,0.00,,
209063306,"SUTURA: NYLON MONOFILAMENTO, CALIBRE 5-0, LONGITUD 45 CM., AGUJA DE 19 MA 20 MM., ? C÷RCULO, PUNTA CORTANTE. ",0.85 ,0 ,0 ,0 ,0,0.00,,
209063308,"SUTURA: POLIPROPILENO MONOFILAMENTO, CALIBRE 7-0",2.65 ,0 ,"1,680 ",0 ,"1,680","4,444.86",,
209063313,"SUTURA MONOFILAMENTO POLIDIOXANONA CALIBRE 4-0 Descripci¢n del producto: Sutura Monofilamento de Polidioxanona recubierta de triclosan ,incolora,    (SE SOLICITA: calibre 4-0,longitud 45cm, aguja de 19mm,3/8 circulo,punta cortante.)",7.11 ,0 ,0 ,0 ,0,0.00,,
209063317,SUTURA MONOFILAMENTO POLIDIOXANONA  CALIBRE 1 SE SOLICITA CON AGUJA 36.4MM Y LONGITUD DE 70 CM                                                                                                                                                                                                                                                                                                                                                                                                                                                          ,17.78 ,0 ,0 ,0 ,0,0.00,,
209063318,"SOLUCION ADHESIVA TOPICA PARA LA SUTURA DE LA PIEL  (SE SOLICITA DE 0.5ML
ESTERIL DE USO UNICO, EN ENVASE BURBUJA CON PUNTA, APLICADOR, DE FORMULACION MONOMETRICA DE (2
OCTIL CIANOACRILATO) Y CON BARRERA MICROBIAL DE 0.25ML,0.50ML,0.75ML DE LIQUIDO ADHESIVO.)",42.63 ,0 ,0 ,0 ,0,0.00,,
209063402,"SUTURA: µCIDO POLIGLIC‡LICO TRENZADO, CALIBRE  0, SE SOLICITA AGUJA DE 26 MM LONGITUD 75CM",1.37 ,0 ,0 ,0 ,0,0.00,,
209063404,"SUTURA: ACIDO POLIGLICOLICO TRENZADO, CALIBRE 0, LONGITUD 70 CM. AGUJA DE 37 MM. GRUESA 1/2 CIRCULO, PUNTA REDONDA ESTERIL. ",1.32 ,0 ,0 ,0 ,0,0.00,,
209063406,"SUTURA: ACIDO POLIGLICOLICO TRENZADO, CALIBRE 1, SE SOLICITA AGUJA DE 35 MM. LONGITUD 70CM",1.30 ,0 ,0 ,0 ,0,0.00,,
209063500,"SUTURA: µCIDO POLIGLIC‡LICO TRENZADA, CALIBRE 2-0",1.59 ,0 ,0 ,0 ,0,0.00,,
209063504,"SUTURA: µCIDO POLIGLIC‡LICO TRENZADO, CALIBRE 1 LONGITUD 67 A 75 CM. AGUJA DE 35 A 37 MM., 1/2 C÷RCULO, PUNTA REDONDA GRUESA.                                                                                              SOLICITAMOS: AGUJA CALIBRE 36MM LONG 70CM ",1.39 ,0 ,0 ,0 ,0,0.00,,
209063509,"SUTURA ACIDO POLIGLICOLICO TRENZADO, CALIBRE 4-0, SE SOLICITA AGUJA 19MM, 3/8 CIRCULO PUNTA CORTANTE ESTERIL, LONGITUD 45CM",1.38 ,0 ,0 ,0 ,0,0.00,,
209063510,"SUTURA: ACIDO POLIGLIC‡LICO TRENZADO, CALIBRE 4-0",1.36 ,0 ,0 ,0 ,0,0.00,,
209063513,"SUTURA: µCIDO POLIGLIC‡LICO TRENZADO, CALIBRE 3-0 ",1.58 ,"1,056 ",72 ,216 ,"1,344","2,123.52",,
209063802,"SUTURA ACIDO POLIGLICOLICO TRENZADO, SE SOLICITA CALIBRE 6-0",6.67 ,0 ,0 ,0 ,0,0.00,,
209064000,SUTURA: SEDA NEGRA TRENZADA SILICONIZADA CALIBRE 0,0.91 ,0 ,0 ,0 ,0,0.00,,
209064200,SUTURA: SEDA NEGRA TRENZADA SILICONIZADA CALIBRE 1.,0.87 ,0 ,0 ,0 ,0,0.00,,
209064201,"SUTURA: SEDA NEGRA TRENZADA SILICONIZADA, CALIBRE 1,  SE SOLICITA   LONGITUD 75CM.,  10 HEBRAS",1.59 ,0 ,0 ,0 ,0,0.00,,
209064400,"SUTURA: SEDA NEGRA TRENZADA SILIC‡N IZADA CALIBRE 2.0, SE SOLICITA LONGITUD 75CM, 10 HEBRAS",0.91 ,0 ,0 ,0 ,0,0.00,,
209064500,"SUTURA: SEDA NEGRA TRENZADA SILICONIZADA CALIBRE 2.0, SE SOLICITA DE LONGITUD 75CM",0.81 ,0 ,0 ,0 ,0,0.00,,
209064600,"SUTURA: SEDA NEGRA TRENZADA SILIC‡NIZADA, CALIBRE 3-0",1.08 ,0 ,0 ,0 ,0,0.00,,
209064701,"SUTURA: SEDA NEGRA TRENZADA SILICONIZADA, CALIBRE 3-0",0.50 ,0 ,0 ,0 ,0,0.00,,
209064800,SUTURA: SEDA NEGRA TRENZADA SILICONIZADA CALIBRE 3.0   SE SOLICITA AGUJA DE 22 MM,1.75 ,0 ,0 ,0 ,0,0.00,,
209065300,"SUTURA: SEDA NEGRA TRENZADA SILICONIZADA, CALIBRE 4-0, LONGITUD 45cm, AGUJA DE 12 A 13mm, ? C÷RCULO, PUNTA CORTANTE, ESTêRIL",0.72 ,0 ,0 ,0 ,0,0.00,,
209065500,"SUTURA: SEDA NEGRA TRENZADA  SILICONIZADA, CALIBRE 6-0. SE SOLICITA LONGITUD 45 CM.  AGUJA DE 11 A 12 MM., 3/8 CIRCULO, PUNTA CORTANTE",1.28 ,684 ,720 ,144 ,"1,548","1,981.44",,
209066101,"SUTURA: POLIPROPILENO MONOFILAMENTO CALIBRE 3-0, DE LONGITUD 90CM, DOBLE AGUJA DE 25 - 26MM, 1/2 C÷RCULO PUNTA REDONDA ESTêRIL",1.65 ,0 ,"1,200 ",576 ,"1,776","2,921.52",,
209069700,PLANCHA DE CAUTERIO DESECHABLE,3.29 ,0 ,0 ,0 ,0,0.00,,
209076301,"APOSITO PROTECTOR, SE SOLICITA TAMA•O 10CM X 10CM",16.81 ,0 ,0 ,0 ,0,0.00,,
209076401,"APOSITO DE ESPUMA, se solicita Tama§os con borde 15 CM X 20 CM",38.70 ,"6,150 ",100 ,0 ,"6,250","241,875.00",,
209076501,"APOSITO DE ESPUMA, se solicita Tama§os sin borde 12.5CM X 12.5CM",26.50 ,"1,900 ",100 ,0 ,"2,000","53,000.00",,
209076601,"APOSITO DE ESPUMA, se solicita Tama§os SIN BORDEN 20CM X 20CM",47.80 ,"4,250 ",0 ,0 ,"4,250","203,150.00",,
209076701,"CAPA POROSA O BIOMATRIZ, SE SOLICITA TAMA•O 10 cm x 10 cm, con 420 agujeros de 1600 micrones.",60.00 ,"12,630 ","4,600 ",480 ,"17,710","1,062,600.00",,
209077401,"SOLUCI‡N PARA LAVADO, IRRIGACI‡N Y DESBRIDAMIENTO DE HERIDAS, se solicita Botella con tapa rosca 500ml",25.00 ,0 ,334 ,48 ,382,"9,550.00",,
209077501,"SOLUCI‡N PARA LAVADO, IRRIGACI‡N Y DESBRIDAMIENTO DE HERIDAS, se solicita, Dispensador en aerosol con tapa atomizador 250 ml",20.25 ,0 ,152 ,0 ,152,"3,078.00",,
209077601,"SOLUCI‡N PARA LAVADO, IRRIGACI‡N Y DESBRIDAMIENTO DE HERIDAS, se solicita tama§o en bolsas con puerto de irrigaci¢n de 1000 ml.",62.41 ,0 ,138 ,0 ,138,"8,611.89",,
209077701,"SOLUCI‡N PARA LAVADO, IRRIGACI‡N Y DESBRIDAMIENTO DE HERIDAS, SE SOLICITA EL TAMA•O Compresa presaturada Empaque individual de gasa de 8 capas de 10 cm x 10 cm.",6.91 ,0 ,0 ,0 ,0,0.00,,
209077801,"SOLUCI‡N PARA LAVADO, IRRIGACI‡N Y DESBRIDAMIENTO DE HERIDAS SE SOLICITA, Gel Dispensador en spray aerosol 100 g.",47.51 ,0 ,0 ,0 ,0,0.00,,
209091701,"ESPUMA DE POLIURETANO (PU) CON SISTEMA DE CONTROL DE CARGA DE TRANSPIRACI‡N CONTINUA, se solicita 4"" x 5"" (10.2 cm x 12.7 cm)",28.90 ,0 ,0 ,0 ,0,0.00,,
209091801,"ESPUMA DE POLIURETANO (PU) CON SISTEMA DE CONTROL DE CARGA DE TRANSPIRACI‡N CONTINUA, se solicita ""8x8""(20.3 cm x 20.3 cm)",73.42 ,0 ,0 ,0 ,0,0.00,,
209091901,"ESPUMA DE POLIURETANO CON SISTEMA DE CONTROL DE CARGA IMPERMEABLE, se solicita ""4 x 5"" (10.2cm x 12.7 cm)",27.80 ,0 ,0 ,0 ,0,0.00,,
209092001,"ESPUMA DE POLIURETANO CON SISTEMA DE CONTROL DE CARGA IMPERMEABLE, se solicita ""8x8""(20.3 cm x 20.3 cm)",73.42 ,0 ,650 ,0 ,650,"47,723.00",,
209092101,"ESPUMA DE ALCOHOL POLIVINILICO CON SISTEMA DE CONTROL DE CARGA,    (SE SOLICITA ,EXUDADO MODERADO SIN PEL÷CULA DE RETENCI‡N DE HUMEDAD 15.2 cm x 15.2 cm (6? x 6?).",14.61 ,"16,560 ",895 ,750 ,"18,205","265,975.05",,
209092201,"ESPUMA DE ALCOHOL POLIVINILICO CON SISTEMA DE CONTROL DE CARGA,      (SE SOLICITA PARA TUNELIZACION DE 9 mm (1.2g)",14.61 ,"3,610 ","2,450 ",700 ,"6,760","98,763.60",,
209092301,"ESPUMA DE ALCOHOL POLIVINILICO CON SISTEMA DE CONTROL DE CARGA,     (SE SOLICITA, EXUDADO MODERADO SIN PEL÷CULA DE RETENCI‡N DE HUMEDAD, TAMA•O 10.2 cm x 10.2 cm  x 1.29 cm (4"" x 4"" x 0.5"")",56.25 ,0 ,"2,700 ",0 ,"2,700","151,875.00",,
