209092401,"ESPUMA DE ALCOHOL POLIVINILICO CON SISTEMA DE CONTROL DE CARGA,    ( SE SOLICITA , EXUDADO ABUNDANTE SIN PEL÷CULA DE RETENCI‡N DE HUMEDAD TAMA•O De forma isla adherente de 10.2 cm x 12 cm (4"" x 4.75"") y espuma de 5 cm x 7 cm (2"" x 2.75"").",34.98 ,150 ,0 ,"1,300 ","1,450","50,721.00",,
209094100,CUCHILLA PARA PODADORA DE VELLOS Y CABELLOS CON SISTEMA OSCILANTE (Ofrecer Nueva Tecnologia) SE SOLICITAN UN MINIMO DE 100,3.11 ,"36,450 ","1,900 ","2,000 ","40,350","125,286.75",,
209100700,ESPECULO VAGINAL (SE SOLICITA TAMA•O CHICO),0.22 ,0 ,0 ,0 ,0,0.00,,
209100701,ESPECULO VAGINAL (SE SOLICITA TAMA•O MEDIANO),1.24 ,"168,650 ",400 ,"2,200 ","171,250","211,493.75",,
209100702,ESPECULO VAGINAL (SE SOLICITA TAMA•O GRANDE)  ,1.23 ,"39,300 ","2,400 ","3,500 ","45,200","55,596.00",,
209111100,"SUTURA µCIDO POLIGLICOLICO TENZADO, SE SOLICITA CALIBRE 3-0",0.94 ,"104,202 ",540 ,288 ,"105,030","98,613.72",,
209111200,SUTURA DE µCIDO POLIGLIC‡LICO CALIBRE 0 DE 60-75CM DE LONGITUD.,3.35 ,0 ,0 ,0 ,0,0.00,,
209111300,"MATRIZ EXTRACELULAR TRIDIMENSIONAL, SE SOLICITA 7 x 20CM, MALLA",295.60 ,160 ,0 ,0 ,160,"47,296.00",,
209111600,"MATRIZ DE CELULOSA OXIDADA REGENERADA Y COL∑GENO, SE SOLICITA TAMA•O 123 CENTIMETROS CUADRADOS.                                                                                                                                                                                                                                                                      ",54.80 ,0 ,0 ,0 ,0,0.00,,
209112500,INSTRUMENTO O PINZA CURVA PARA FUSION DE TEJIDOS PARA ELECTROCAUTERIO MULTIMODAL O BIPOLAR AVANZADO (CIRUGIA ABIERTA) DESECHABLE,625.00 ,0 ,240 ,0 ,240,"150,000.00",,
209112600,PINZA LAPARASCOPICA DE 10 MM CON CORTE INCORPORADO PARA SELLADO DE VASOS SANGUINEOS MEDIANTE PRESION.                                                                                                                                                         ,404.75 ,0 ,0 ,0 ,0,0.00,,
209112700,"LAPIZ PARA ELECTROCAUTERIO MULTIMODAL (CORTE,DISECCION Y COAGULACION)                                                                                                                                                                                                                                                             ",43.21 ,0 ,0 ,0 ,0,0.00,,
209112800,"PINZA PARA FUSION DE TEJIDOS Y DISECCION MONOPOLAR DE 5MM LAPARASCOPICA PARA ELECTROCAUTERIO MULTIMODAL, Se Solicita de 37 Long, mandibula curva. ",846.54 ,0 ,0 ,0 ,0,0.00,,
209112900,PINZA LAPARASCOPICA DE 5 MM CON CORTE INCORPORADO PARA SELLADO DE VASOS SANGUINEOS MEDIANTE PRESION.                                                                                                                              ,587.50 ,0 ,80 ,0 ,80,"47,000.00",,
209113300,"TROCAR PARA CIRUGIA LAPAROSCOPICA DE 2MM A 15MM DE DIAMETRO, PUNTA CORTANTE DESECHABLE CON PROTECCION ACTIVA Y REDUCTOR INCORPORADO",64.62 ,"1,200 ",0 ,0 ,"1,200","77,544.00",,
209113400,INSTRUMENTO PARA PROLAPSO RECTAL Y HEMORROIDES,199.50 ,152 ,48 ,0 ,200,"39,900.00",,
209113500,TROCAR PARA CIRUGIA LAPAROSCOPICA  DE 5MM A 12MM DE DIAMETRO CON SISTEMA DE ANCLAJE (TIPO HASSAN O TêCNICA ABIERTA) PUNTA ROMA DESECHABLE.                                             ,68.35 ,0 ,72 ,0 ,72,"4,920.84",,
209113600,"MALLA TRI-LAMINADA DELGADA.  (SE SOLICITA TAMA•O 8"" X 12"" (20 X 30cm))","1,651.43 ",0 ,0 ,0 ,0,0.00,,
209113700,HEMOSTATICO ABSORVIBLE DE TEXTURA ALGODONOSA            (SE SOLICITA: TAMA•O: 2.5 X 5CM),110.00 ,0 ,0 ,0 ,0,0.00,,
209119500,SUTURA MONOFILAMENTO POLIDIOXANONA  CALIBRE 1  (SE SOLICITA AGUJA  70MM ),19.70 ,0 ,0 ,0 ,0,0.00,,
209119600,"SUTURA MONOFILAMENTO SINTETICO ABSORBIBLE, SE SOLICITA CALIBRE 5-0",1.56 ,"70,800 ","1,140 ",0 ,"71,940","112,182.52",,
209119700,"SUTURA: MONOFILAMENTO SINTETICO ABSORBIBLE, CALIBRE 4-0 ",1.37 ,"10,572 ",720 ,288 ,"11,580","15,836.46",,
209119900,"CANULA DE ASPIRACION TIPO YANKEUER. SE SOLICITA TIPO RIGIDA DE ADULTO de 12"" y tuberia de 72"" o MAS",1.55 ,0 ,0 ,0 ,0,0.00,,
209125001,"SISTEMA DE ENGRAPADO O LIGADURA, PARA CLIP DE POLIMERO NO ABSORBIBLE",89.59 ,0 ,0 ,0 ,0,0.00,,
209155001,"GUANTES QUIRÈRGICOS LIBRES DE LATEX Y POLVO, ESTêRIL  SE SOLICITA TAMA•O 6 1/2",1.31 ,0 ,0 ,0 ,0,0.00,,
209155101,"GUANTES QUIRÈRGICOS LIBRES DE LATEX Y POLVO, ESTêRIL                      (SE SOLICITA TAMA•O 7)",1.64 ,0 ,0 ,0 ,0,0.00,,
209155201,"GUANTES QUIRÈRGICOS LIBRES DE LATEX Y POLVO, ESTêRIL . SE SOLICITA TAMA•O 7.5",1.64 ,0 ,0 ,0 ,0,0.00,,
209158201,GLUCONATO DE CLORHEXIDINA AL 4% EN ESPUMA PARA ANTISEPSIA DE MANO.   ( LA EMPRESA QUE SE LE ADJUDIQUE DEBE PROPORCIONAR ELSISTEMA DE DISPENSACION POR BOMBA DE PIE) ,28.94 ,0 ,0 ,0 ,0,0.00,,
209158301,"GUANTES DE NITRILO PARA EXAMEN SIN POLVO, NO ESTêRIL.       (SE SOLICITA TAMA•O MEDIANO)",0.04 ,0 ,0 ,0 ,0,0.00,,
209158401,"GUANTES DE NITRILO PARA EXAMEN SIN POLVO, NO ESTêRIL.     (SE SOLICITA TAMA•O GRANDE)",0.04 ,0 ,0 ,0 ,0,0.00,,
209160401,SOLUCION QUIRURGICA ANTISEPTICO PARA LA PIEL. SE SOLICITA VOLUMEN DE 26ML,11.31 ,0 ,0 ,0 ,0,0.00,,
209163501,"SUTURA: POLIPROPILENO MONOFILAMENTO, CALIBRE 6-0  ( 1/2 de circulo)",4.46 ,0 ,0 ,0 ,0,0.00,,
209163901,"INJERTO VASCULAR CONICO CON ANILLOS INTEGRADOS AL PTFE.   (SE SOLICITA: CON HEPARINA BIOACTIVA, CAN ANILLO INTEGRAD, INJERTO VASCULAR C‡NICO Entre 4MM y 6MM ,Longitud 45CM).","1,815.00 ",0 ,0 ,0 ,0,0.00,,
209168001,"INJERTO VASCULAR CONICO CON ANILLOS INTEGRADOS AL PTFE.   SE SOLICITA:  CON HEPARINA BIOACTIVA, CAN ANILLO INTEGRAD, INJERTO VASCULAR C‡NICO ENTRE 4MM y  7MM , LONGITUD 45CM","1,850.00 ",375 ,0 ,0 ,375,"693,750.00",,
209170601,"ESPIROMETRO INCENTIVO PARA REALIZAR EJERCICIOS DE RESPIRACION PROFUNDA.
(DESECHABLE):",19.95 ,"40,560 ",576 ,384 ,"41,520","828,145.05",,
209171801,LENTE INTRAOCULAR PLEGABLE DE ACRILICO HIDROFOBICO DE +10.00 A +30.00 DIOPTRIAS.,39.90 ,505 ,5 ,0 ,510,"20,349.00",,
209175902,"CEPILLO PARA LAVADO QUIRURGICO DESECHABLE CON CLOREXIDINA AL 4%,ESTERIL",0.68 ,0 ,0 ,0 ,0,0.00,,
209193700,DELANTAL PROTECTOR DE FLUIDOS   (JUMSUIT) ,41.13 ,"497,000 ","23,200 ","13,596 ","533,796","21,955,029.48",,
209196401,"Cuchillete con Mango de 15ß hasta 45ß  (se solicita de 15¯) Desechable, esteril, con hoja en forma de lanceta de una sola pieza de 3 a 5mm.",10.95 ,0 ,0 ,0 ,0,0.00,,
209203101,GLUCONATO DE CLORHEXIDINA AL 2% EN ESPUMA PARA ANTISEPSIA DE MANO. ( LA EMPRESA QUE SE LE ADJUDIQUE DEBE PROPORCIONAR EL SISTEMA DE DISPENSACION POR BOMBA DE PIE)  ,19.25 ,"2,000 ",0 ,0 ,"2,000","38,500.00",,
209214901,CANULA NASOFARINGEA DE 32 FR A 36 FR.                 (SE SOLOCITA TAMA•0 32FR) ,3.69 ,"6,700 ",500 ,0 ,"7,200","26,593.92",,
209215001,CANULA NASOFARINGEA  DE 32 FR A 36 FR.                        (SE SOLOCITA TAMA•0 34FR),3.69 ,"3,650 ",500 ,0 ,"4,150","15,299.39",,
209215101,CANULA NASOFARINGEA  DE 28 FR A 30 FR. SE SOLOCITA TAMA•0 30FR      ,3.69 ,0 ,"1,050 ",0 ,"1,050","3,878.07",,
209215201,CANULA NASOFARINGEA  DE 28 FR A 30 FR. SE SOLOCITA TAMA•0 28FR   ,3.65 ,450 ,500 ,0 ,950,"3,471.30",,
209223001,"CAL SODADA SIN PRODUCCION DEL COMPUESTO A. SE SOLICITA BOLSA DE 1KG? Indicador de violeta de etilo <1%? Hidr¢xido de calcio de porcentaje de peso >75%.? En caso que contenga catalizador: Cloruro de litio de % de peso entre 0% y 3% ¢ Hidr¢xido de Sodio entre 0% y 2%
",110.17 ,0 ,0 ,0 ,0,0.00,,
209235401,"GASA 2"" X 2"" X 16 DOBLECES, ESTêRIL",0.03 ,0 ,0 ,0 ,0,0.00,,
209235501,"GASA 2"" X 2"" X 16 DOBLECES CON ELEMENTO RADIOPACO, ESTERIL",0.03 ,0 ,0 ,0 ,0,0.00,,
209235601,"GASA 3"" X 3"" X 16 DOBLECES, ESTERIL",0.07 ,0 ,0 ,0 ,0,0.00,,
209235801,"GASA 8"" X 4"" X 16 DOBLECES, ESTêRIL",0.07 ,0 ,0 ,0 ,0,0.00,,
209235901,"GASA 8"" X 4"" X 16 DOBLECES CON ELEMENTOS RADIOPACO, ESTêRIL",0.26 ,0 ,0 ,0 ,0,0.00,,
209236101,"GASA SIMPLE 4"" X 4"" X 16 ESTêRIL",0.21 ,0 ,0 ,0 ,0,0.00,,
209244001,"AGUJAS PARA LOCALIZACION Y BLOQUEO DE NERVIO PERIFERICO.                             (SE SOLICITA TAMA•O 22Ga X 2"").",11.80 ,"2,600 ",100 ,0 ,"2,700","31,860.00",,
209268501,"CIRCUITO DESECHABLE DE VENTILADOR INTEGRADO DE HUMIDIFICACI‡N PASIVA Y
FILTRACI‡N DE 72 HORAS DE USO",79.00 ,"8,740 ","4,080 ",230 ,"13,050","1,030,950.00",,
209269601,"GUANTES DE NITRILO PARA EXAMEN SIN POLVO, NO ESTêRIL. SE SOLICITA TAMA•O CHICO",0.04 ,0 ,0 ,0 ,0,0.00,,
209270001,"SET DE ROPA
",12.34 ,"99,550 ",0 ,20 ,"99,570","1,228,693.80",,
209286501,"CINTURON SEGURIDAD PARA MARCHA DE ADULTO                    (SE SOLICITA TAMA•O PEQUE•A DE 34""-30"")",82.72 ,150 ,38 ,0 ,188,"15,551.99",,
209286601,"CINTURON SEGURIDAD PARA MARCHA ADULTO.  (SE SOLICITA MEDIANO 30""-44"")",110.00 ,615 ,0 ,0 ,615,"67,650.00",,
209286701,"CINTURON SEGURIDAD PARA MARCHA DE ADULTO.         (SE SOLICITA GRANDE 44""-60"")",82.72 ,520 ,190 ,0 ,710,"58,733.61",,
209292901,BOLSA PARA OBTENCI‡N DE MUESTRAS EN CIRUG÷A LAPAROSC‡PICA (Se solicita de 6.4cm x 15cm),150.00 ,0 ,0 ,0 ,0,0.00,,
209296301,TIJERA PARA CORTE Y LIGADURA DE CORD‡N UMBILICAL CON BISTUR÷. ,183.75 ,0 ,0 ,0 ,0,0.00,,
209298301,SET DE ROPA DESECHABLE PARA CIRUGIA OFTALMOLOGICA,39.99 ,"12,950 ",0 ,950 ,"13,900","555,861.00",,
209313501,"CUCHILLETE     (SE SOLICITA  2,2mm)",11.98 ,0 ,0 ,720 ,720,"8,622.00",,
209321101,SISTEMA DE DRENAJE TORACICO DE TRES CAMARAS. SE SOLICITA DRENAJE CERRADO DE 1 TUBO,37.13 ,0 ,0 ,0 ,0,0.00,,
209330401,"RESPIRADORES CONTRA PARTICULAS DE ALTA FILTRACION N95 CON O SIN VALVULA DE EXALACION.                                                                                                   (SOLICITAMOS TAMA•O MEDIANO ,SIN VALVULA DE EXALACION)",0.97 ,0 ,0 ,0 ,0,0.00,,
209332801,BANDEJA DE ANESTESIA EPIDURAL CONTINUA DESECHABLE CON MEDICAMENTO. SE SOLICITA AGUJA TUOHY/HUBER DE 17G X 88 a 90mm SIN ALAS,30.00 ,0 ,0 ,500 ,500,"15,000.00",,
209338801,"EMPAQUES O COMPRESA CALIENTE (SE SOLICITA CONTORNO PARA CUELLO 61X15 CM 24"" X 6"")",36.64 ,0 ,50 ,50 ,100,"3,664.09",,
209355401,"BOLSA MIXTA TERMOSELLABLE PARA ESTERILIZAR, 6"" X 12"" (150 X 300MM)",0.11 ,"505,800 ","134,260 ","3,500 ","643,560","70,791.60",,
209375401,"JUEGO COMPLETO PARA CATETERIZACI‡N VESICAL CON SONDA FOLEY SE SOLICITA 16Fr DE SILICONA, CAPACIDAD DE BOLSA DE 2000cc, Soluci¢n para limpieza de Clorexidina acuosa al 1% CON Jeringuilla prellenada con agua bidestilada de  10cc CON UN PAR DE GUANTES DE NITRILO O VINILO",15.91 ,"26,180 ","2,720 ",280 ,"29,180","464,253.80",,
209375601,"JUEGO COMPLETO PARA CATETERIZACI‡N VESICAL CON SONDA FOLEY SE SOLICITA 18Fr DE SILICONA, CAPACIDAD DE BOLSA DE 2000cc, Soluci¢n para limpieza de Clorexidina acuosa al 1% CON Jeringuilla prellenada con agua bidestilada de  10cc CON UN PAR DE GUANTES DE NITRILO O VINILO",13.00 ,"24,327 ","5,282 ",220 ,"29,829","387,777.00",,
209377501,"GUANTES QUIRÈRGICOS LIBRES DE LATEX Y POLVO, ESTêRIL  SE SOLICITA TAMA•O 6",1.64 ,0 ,0 ,0 ,0,0.00,,
209393201,APOSITO DE ESPUMA 3D CON PLATA IONICA SE SOLICITA APOSITO NO ADHESIVO TAMA•O 10X 10CM ,21.00 ,"29,040 ","6,220 ",320 ,"35,580","747,180.00",,
209416401,"JUEGO COMPLETO PARA SUCCI‡N DE V÷AS RESPIRATORIAD, PEDIATRICO Y ADULTO. SE SOLICITA TAMA•O 6FR",1.37 ,"4,550 ",250 ,0 ,"4,800","6,576.00",,
209419501,DETERGENTE LIQUIDO CON ENZIMAS (SE SOLICITA DE 4 ENZIMA),35.63 ,"7,494 ","1,544 ",584 ,"9,622","342,831.86",,
209419601,TORRE DE HISTEROSCOPIA DE FLUJO CONTINUO PARA GINECOLOGIA:   SE SOLICITA ACCESORIO  JUEGOS DE TUBOS DE SILICON REUSABLE,55.36 ,80 ,0 ,0 ,80,"4,428.80",,
209422201,"MULTICAPA DE TRIPLEACCION A BASE DE OCTENIDINA Y ACIDO HIALURONICO TAMA•O: 10CM X 10CM (3.9"" X 3.9"")",0.11 ,0 ,340 ,0 ,340,37.40,,
209423401,CATETER DE ARTERIA RADIAL PARA MONITORIZACION DE PRESION Y TOMA DE MUESTRAS SE SOLICITA CON ALETAS DE 3Fr Y 5cms DE LONGITUD DE POLIURETANO CON PUNTA RECTA,76.00 ,0 ,0 ,0 ,0,0.00,,
209434101,TIJERA PARA BISTURI ARMONICO CON CONTROL MANUAL Y ALTA FRECUENCIA.  (SE SOLICITA VASTAGO DE 9CM),"1,090.00 ",0 ,0 ,0 ,0,0.00,,
209443301,"GUANTES QUIRÈRGICOS DE LµTEX, ESTêRIL (Se solicita tama§o 6)                                                                                                                                                                                                                                                     ",0.28 ,0 ,0 ,0 ,0,0.00,,
209454501,BOLSA INFUSORA A PRESION .SE SOLICITA BOLSA DE 1000cc DE CAPACIDAD,51.38 ,0 ,425 ,0 ,425,"21,836.50",,
209458401,MATRIZ EXTRACELULAR TEJIDO FIBROSO (Se solicita de 5 x 5cm) ,70.07 ,0 ,0 ,0 ,0,0.00,,
209459201,SET DE ROPA PARA CITOSCOP÷A,25.98 ,"45,930 ",290 ,"2,472 ","48,692","1,265,018.16",,
209462801,FERULAS SINTETICAS EN ROLLO SE SOLICITA DE 7.5CM X 4.6M,112.06 ,80 ,36 ,80 ,196,"21,963.76",,
209462901,FERULA SINTETICAS EN ROLLO SE SOLICITA DE 12.5CM X 4.6M,163.88 ,860 ,22 ,100 ,982,"160,930.16",,
209464201,FERULAS SINTETICAS EN ROLLO SE SOLICITA DE 5CM X 4.6M,92.04 ,0 ,275 ,0 ,275,"25,311.00",,
209464301,"FERULAS SINTETICAS EN ROLLO SE SOLICITA DE 10CM X 4,6M",138.50 ,10 ,30 ,100 ,140,"19,390.00",,
209471301,JUEGO DE ROPA DESECHABLE PARA CAMA DE PACIENTE,3.39 ,"147,500 ",0 ,"7,400 ","154,900","525,111.00",,
209472501,"VENDA DE YESO DE POLIESTER SE SOLICITA 5""X4 YARDAS. ",6.23 ,"51,075 ","10,355 ",0 ,"61,430","382,708.90",,
209472601,BANDEJA PARA INSERCION DE SONDA VESICAL ,1.90 ,"2,250 ",450 ,0 ,"2,700","5,130.00",,
209479001,BOLSA INFUSORA A PRESION. SE SOLICITA BOLSA DE 500cc DE CAPACIDAD,21.60 ,0 ,0 ,0 ,0,0.00,,
209484301,"BANDEJA PARA CATETERIZACION VENOSO CENTRAL DOBLE LUMEN NEONATAL.  SE SOLICITA 4FR X 5CM, DE POLIURETANO",64.50 ,"1,000 ",200 ,0 ,"1,200","77,400.00",,
209484401,"BANDEJA PARA CATETERIZACION VENOSO CENTRAL DOBLE LUMEN NEONATAL.  SE SOLICITA 4FR X 8CM, DE POLIURETANO",64.50 ,100 ,20 ,0 ,120,"7,740.00",,
209484701,BANDEJA PARA CATETERIZACION VENOSO CENTRAL TRIPLE LUMEN PEDIATRICA. SE SOLICITA MATERIAL DE CATETER CON POLIURETANO DIAMETRO 5 FR X 8CM DE LONGITUD.,73.50 ,50 ,0 ,0 ,50,"3,675.00",,
209484801,BANDEJA PARA CATETERIZACION VENOSO CENTRAL TRIPLE LUMEN PEDIATRICA.   SE SOLICITA MATERIAL DE CATETER CON POLIURETANO DIAMETRO 5FR X 12CM DE LONGITUD,162.00 ,100 ,20 ,0 ,120,"19,440.00",,
209485301,"SUTURA: POLIPROPILENO MONOFILAMENTO, CALIBRE 5-0.(SE SOLICITA LONGITUD DE 75 CM) ",3.97 ,"27,840 ",60 ,0 ,"27,900","110,763.00",,
209485401,PERILLA (BULBO) DE SUCCION - IRRIGACION DE 2 ONZAS ESTERIL,0.66 ,"9,304 ",300 ,0 ,"9,604","6,290.62",,
209485501,GUANTES QUIRURGICO DE LATEX ESTERIL                                                               (SE SOLICITA TAMA•O 8 1/2),0.28 ,0 ,0 ,0 ,0,0.00,,
209485901,BANDAS ELµSTICAS PARA FORTALECIMIENTO SE SOLICITA ULTRA SUAVE,103.91 ,515 ,75 ,35 ,625,"64,946.29",,
209486001,BANDAS ELµSTICAS PARA FORTALECIMIENTO   (SE SOLICITA MEDIANA),102.39 ,0 ,0 ,40 ,40,"4,095.44",,
209486101,BANDAS ELµSTICAS PARA FORTALECIMIENTO                     (SE SOLICITA FUERTE) ,100.00 ,525 ,165 ,90 ,780,"78,000.00",,
209486201,BANDAS ELµSTICAS PARA FORTALECIMIENTO                       (SE SOLICITA -EXTRA FUERTE),126.55 ,125 ,75 ,65 ,265,"33,535.72",,
209486401,BANDAS ELµSTICAS PARA FORTALECIMIENTO                     (SE SOLICITA -SUPER FUERTE),100.00 ,0 ,16 ,95 ,111,"11,100.00",,
209489901,"APOSITO ELECTROESTATICO LAMINADO DE CARBON ACTIVADO DE BAJA ADHERENCIA SE SOLICITA TAMA•O: 20 CM X 10 CM (8"" X 4"")",36.75 ,0 ,0 ,0 ,0,0.00,,
209493501,BANDAS ELµSTICAS PARA FORTALECIMIENTO.                    (SE SOLICITA SUAVE),103.91 ,1 ,75 ,65 ,141,"14,651.88",,
209496501,"APOSITO ELECTROESTµTICO DE TRIPLE ACCI‡N SE SOLICITA TAMA•O: 10 CM X 10 CM (4"" X 4"")",24.00 ,"2,190 ","2,200 ",0 ,"4,390","105,360.00",,
209518001,"AP‡SITO HIDROCOLOIDE (Est†ndar, Regular o Extra Absorbente).  SE SOLICITA  CUADRADO 10CM X 10CM",2.98 ,"8,000 ","3,330 ",440 ,"11,770","35,015.75",,
209519101,RECIPIENTE DESECHABLE PARA SISTEMA DE DRENAJE TORµCICO DIGITAL (Se solicita de 300cc polipropileno) ,16.75 ,0 ,0 ,0 ,0,0.00,,
209521601,"AGUJAS PARA LOCALIZACION Y BLOQUEO DE NERVIO PERIFERICO.  SE SOLICITA TAMA•O 22Ga X 3 1/4"" ",11.80 ,640 ,0 ,0 ,640,"7,552.00",,
209540801,HIALURONATO S‡DICO,25.89 ,"8,725 ","1,965 ",284 ,"10,974","284,116.86",,
209541001,"FORRO PROTECTOR DE COLCHON SE SOLICITA TAMA•O 38"" X 80""",44.88 ,"17,800 ","1,630 ","1,900 ","21,330","957,290.40",,
209542201,"SUTURA: ACIDO POLIGLIC‡LICO TRENZADO, CALIBRE 3-0, LONGITUD 67 A 75 CM.  AGUJA DE 15 A 17 MM., 1/2 CIRCULO, PUNTA REDONDA. SE SOLICITA LONGITUD DE 75CM Y AGUJA DE 15MM",1.34 ,"43,140 ",0 ,0 ,"43,140","57,591.90",,
209546001,MASCARILLA RECTANGULAR DE 3 PLIEGUES CON SUJECION EN LA OREJA. ,0.31 ,0 ,0 ,0 ,0,0.00,,
209546301,"BATA DESECHABLE, PARA USO GENERAL NO ESTERIL .AAMI     NIVEL 3.  SE SOLICITA TAMA•O REGULAR O UNIVERSAL (MEDIANO -GRANDE)",0.58 ,0 ,0 ,0 ,0,0.00,,
209546401,"BATA DESECHABLE, PARA USO GENERAL NO ESTERIL .AAMI NIVEL 3.       (SE SOLICITA TAMA•O GRANDE)",0.60 ,0 ,0 ,0 ,0,0.00,,
209559101,VENDAJE NEUROMUSCULAR. SE SOLICITA DE 5CM X 5MT,12.50 ,0 ,0 ,0 ,0,0.00,,
209559201,"MU•EQUERA CON BARRA DE 6? U 8? DERECHA O IZQUIERA, CON CIERRE DE VELCRO. SE SOLICITA  TAMA•O CHICO",40.69 ,"1,121 ",0 ,0 ,"1,121","45,613.49",,
209559401,"INMOVILIZADOR DE RODILLA UNIVERSAL. SE SOLICITA TAMA•O  16"" DE LONGITUD",44.78 ,0 ,0 ,0 ,0,0.00,,
209559601,INMOVILIZADOR ELµSTICO DE HOMBRO                           (SE SOLICITA TAMA•O SMALL)    ,44.65 ,496 ,248 ,0 ,744,"33,219.60",,
209559701,"CALCETA TUBULAR.    SE SOLICITA  MEDIA TEJIDA DE ALGOD‡N 2"" X 25 YARDAS DE LONGITUD",12.11 ,"1,040 ",208 ,0 ,"1,248","15,107.04",,
209559801,"MU•EQUERA CON BARRA DE 6? U 8? DERECHA O IZQUIERA, CON CIERRE DE VELCRO  (SE SOLICITA  TAMA•O MEDIANO)",40.00 ,500 ,0 ,0 ,500,"20,000.00",,
209559901,"MU•EQUERA CON BARRA DE 6? U 8? DERECHA O IZQUIERA, CON CIERRE DE VELCRO, SE SOLICITA  TAMA•O GRANDE ",40.69 ,458 ,0 ,0 ,458,"18,636.02",,
209560201,"INMOVILIZADOR DE RODILLA UNIVERSAL                                                SE SOLICITATAMA•O 20"" DE LONGITUD",44.54 ,626 ,138 ,0 ,764,"34,028.56",,
209560301,"INMOVILIZADOR DE RODILLA UNIVERSAL   SE SOLICITA  Tama§os : 24"". de longitud",40.52 ,660 ,132 ,0 ,792,"32,091.84",,
209560401,INMOVILIZADOR ELµSTICO DE HOMBRO SE SOLICITA TAMA•O MEDIANO,14.54 ,"1,562 ",631 ,0 ,"2,193","31,886.22",,
209560501,INMOVILIZADOR ELµSTICO DE HOMBRO (SE SOLICITA TAMA•O LARGO),13.89 ,564 ,0 ,0 ,564,"7,832.83",,
209564401,SUTURA POLIGLACTINA 910 RECUBIERTO DE POLIGLACTINA 370 Y TRICLOSAN (SUTURA ACTIVA).CALIBRE 1 .   (SE SOLICITA AGUJA 36.4MM Y LONGITUD DE 90CM)                                                                                                                                                                                                                 ,5.36 ,"6,660 ",432 ,"1,584 ","8,676","46,503.36",,
209564501,"SUTURA MONOFILAMENTO POLIDIOXANONA  CALIBRE 1                                                                                                                                                                                                                                                                                                                                                                                                                                                         DESCRIPCION: Recubierta de triclosan color violeta, longitud entre 70cm y 90cm, con aguja de 36.4mm, 40mm ¢ 48mm de 1/2 circulo, punta ahusada. (SE SOLICITA CALIBRE 1 CON AGUJA 40MM Y LONGITUD DE 90 CM)",18.37 ,0 ,0 ,0 ,0,0.00,,
209565201,BANDEJA PARA CATETERIZACION VENOSO CENTRAL TRIPLE LUMEN PEDIATRICA.    SE SOLICITA MATERIAL DE CATETER CON POLIURETANO DIAMETRO 5FR X 15CM DE LONGITUD.,165.00 ,"1,000 ",200 ,0 ,"1,200","198,000.00",,
209566001,"RECIPIENTE DESECHABLE PARA SISTEMA DE DRENAJE TORµCICO DIGITAL (Se solicita recipiente de 2000, polipropileno) ",135.00 ,0 ,0 ,0 ,0,0.00,,
209566101,TUBO PARA SISTEMA DE DRENAJE TORµXICO DIGITAL CONEXI‡N SIMPLE SE SOLICITA 1.5 M,27.00 ,200 ,770 ,0 ,970,"26,190.00",,
209566801,AGUJA PARA LA LOCALIZACION DE LESIONES MAMARIAS . SOLICITA CALIBRE 20 G A Y 10 cm                                                                                                       ,10.95 ,0 ,0 ,0 ,0,0.00,,
209585001,AP‡SITO CON MATRIZ DE COLAGENO CON PLATA,50.00 ,"4,780 ",400 ,0 ,"5,180","259,000.00",,
209590301,TIJERA PARA BISTURI ARMONICO CON CONTROL MANUAL Y ALTA FRECUENCIA.  SE SOLICITA VASTAGO DE 45CM,897.50 ,0 ,0 ,0 ,0,0.00,,
209603601,"RESPIRADORES CONTRA PARTICULAS DE ALTA FILTRACION N95 CON O SIN VALVULA DE EXALACION. SE SOLICITA TAMA•O GRANDE, CON VALVULA DE EXALACI‡N ",5.70 ,0 ,0 ,0 ,0,0.00,,
209611001,"EMPAQUES O COMPRESA CALIENTE. (SE SOLICITA TAMA•O ESTµNDAR DE 25CM X 30CM 10""X12"")",24.49 ,24 ,36 ,0 ,60,"1,469.40",,
209666301,ROPA DESECHABLE DE NEUROCIRUG÷A,54.95 ,25 ,645 ,0 ,670,"36,816.50",,
209726201,"FIJACION CUTANEO CON ADHESIVO DE SILICONA Y DOBLE PROTECCION ANTIMICROBIANA DE CLORHEXIDINA Y PLATA CON VENTANA SE SOLICITA TAMA•O: 6cm x 7cm
",18.50 ,0 ,0 ,0 ,0,0.00,,
209726301,"FIJACION CUTANEO CON ADHESIVO DE SILICONA Y DOBLE PROTECCION ANTIMICROBIANA DE CLORHEXIDINA Y PLATA CON VENTANA SE SOLICITA TAMA•O: 10cm x 12cm
",29.50 ,0 ,0 ,0 ,0,0.00,,
209770201,GORRO PARA VARON.,0.05 ,"2,855,000 ","165,000 ","267,500 ","3,287,500","147,937.50",,
209770301,GORRO PARA MUJERES.,0.03 ,"1,492,000 ","650,000 ","73,000 ","2,215,000","55,375.00",,
209817201,ROPA DESECHABLE PARA LAPARATOMIA,13.09 ,450 ,200 ,620 ,"1,270","16,624.30",,
209819201,MANGA DE COMPRESION NEUMATICA SECUENCIAL Y/O INTERMITENTE PARA  PANTORRILLA PARA LA PROFILAXIS DE LA TROMBOSIS VENOSA PROFUNDA. SE SOLICITA TAMA•O GRANDE.,33.10 ,"2,880 ",0 ,0 ,"2,880","95,328.00",,
209819301,MANGA DE COMPRESION NEUMATICA SECUENCIAL Y/O INTERMITENTE PARA  PANTORRILLA PARA LA PROFILAXIS DE LA TROMBOSIS VENOSA PROFUNDA.    SE SOLICITA TAMA•O  MEDIANO,33.25 ,"5,480 ","2,240 ",40 ,"7,760","258,020.00",,
209821001,SISTEMA INTEGRADO DE CIERRE DE PUERTOS (DUAL) PARA PROCEDIMIENTOS LAPAROSC‡PICOS,201.34 ,0 ,0 ,0 ,0,0.00,,
209833001,JERINGUILLA DE 1cc (?-100) PARA INSULINA DE RETRACCION. SE SOLICITA 30G X 8MM,0.38 ,0 ,"2,000 ",0 ,"2,000",760.00,,
209833101,JERINGUILLA DE 0.5cc (›ﬁ-100) PARA INSULINA DE RETRACCION     (SE SOLICITA 30G X 8MM),0.33 ,"3,400 ","316,000 ",800 ,"320,200","105,666.00",,
209833401,SET DE ROPA DESECHABLE PARA DILATACION Y CURETAJE,20.42 ,"45,778 ","10,574 ",600 ,"56,952","1,162,959.84",,
209833501,FERULAS SINTETICAS EN ROLLO SE SOLICITA DE 15CM X 4.6M,184.94 ,730 ,70 ,0 ,800,"147,952.00",,
209833601,"CATETER INTRAVENOSO DE BIOSEGURIDAD   (SE SOLICITA CATETER DE POLIURETANO TAMA•O 18G X 1 1/4"")",0.87 ,"812,400 ","38,000 ","98,200 ","948,600","825,282.00",,
209833701,"CATETER INTRAVENOSO DE BIOSEGURIDAD.  SE SOLICITA CATETER DE POLIURETANO TAMA•O 20G X 1""  A 1 3/4""",1.17 ,0 ,0 ,0 ,0,0.00,,
209833801,"CATETER INTRAVENOSO DE BIOSEGURIDAD SE SOLICITA CATETER DE POLIURETANO TAMA•O 22G X 1 """,1.07 ,"201,800 ","75,800 ","53,200 ","330,800","352,302.00",,
209833901,CATETER INTRAVENOSO DE BIOSEGURIDAD 1. CatÇter con sistema de seguridad de retracci¢n autom†tica al extraer la gu°a o aguja ,0.83 ,"516,400 ","33,400 ","56,000 ","605,800","502,814.00",,
209834001,CANULA NASOFARINGEA  DE 20 FR A  26 FR.  (SE SOLOCITA TAMA•0 26FR) ,3.81 ,"12,680 ","3,170 ",0 ,"15,850","60,388.50",,
209834201,"FILTRO DE C02 DESECHABLE (Se Solicita Con filtros de CO2 desechables (50 unidades) con su tuber°a seg£n fabricante, o Con filtros de CO2 desechables (100 unidades) sin tuber°a seg£n fabricante)",10.00 ,0 ,0 ,0 ,0,0.00,,
209834501,SISTEMA DE DOS PIEZAS PARA COLOSTOMIA /ILEOSTOMIA PARA ADULTO ABIERTO.  (SE SOLICITO DIAMETRO EXTERNO DE 50MM),4.55 ,0 ,0 ,0 ,0,0.00,,
209834601,SISTEMA DE DOS PIEZAS PARA COLOSTOMIA/ILEOSTONIA PARA ADULTO ABIERTA SE SOLICITA DIAMETRO EXTERNO 57MM A 60MM,3.80 ,0 ,"3,900 ","2,700 ","6,600","25,080.00",,
209834701,CANULA NASOFARINGEA  DE 32 FR A 36 FR.  (SE SOLOCITA TAMA•0 36FR)        ,3.69 ,"7,800 ","1,950 ",0 ,"9,750","35,977.50",,
209834801,ENVASE PARA DESECHOS PUNZOCORTANTE SE SOLICITA TAMA•O 7.6 LITROS,5.50 ,0 ,0 ,0 ,0,0.00,,
209834901,ENVASE PARA DESECHOS PUNZOCORTANTE SE SOLICITA TAMA•O 22.7 LITROS,9.50 ,0 ,0 ,0 ,0,0.00,,
209835001,ENVASE PARA DESECHOS PUNZOCORTANTE SE SOLICITA TAMA•O 1.4 LITROS,5.58 ,0 ,0 ,0 ,0,0.00,,
209847501,GUANTES DE NITRILO CON PU•O EXTENDIDO. SE (SOLICITA TAMA•O EXTRA GRANDE),1.65 ,0 ,0 ,0 ,0,0.00,,
209851201,COBERTOR CµMARA DE VIDEO (Se solicita tama§o  17CM X 242CM),2.77 ,360 ,900 ,480 ,"1,740","4,819.80",,
209854501,LAMINA PROTECTORA DE SUPERFICIES AISLANTE DE FLUIDOS CONTAMINANTES.                           ,18.50 ,"323,650 ","103,490 ","6,700 ","433,840","8,026,040.00",,
209865701,APOSITO CON MATRIZ DE COLAGENO (Se solicita 4 pulgadas x 4 pulgadas (10cm x 10cm),51.66 ,0 ,0 ,0 ,0,0.00,,
209868301,TERMOMETRO TIMPANICO DIGITAL   ( SE SOLICITA FUNDA O CUBERTOR DESECHABLE) ,0.05 ,"24,075,000 ","4,934,200 ","217,600 ","29,226,800","1,461,340.00",,
209870701,"SOLUCI‡N DE GLUCONATO DE CLORHEXIDINA AL 2% Y ALCOHOL AL 70%, PARA LA ASEPSIA PRE QUIRÈRGICA DE LA PIEL Y PARA ACCESOS VASCULARES    SE SOLICITA TUBO APLICADOR CON ESPONJA DE 35ML  ENTINTADO",9.00 ,0 ,0 ,0 ,0,0.00,,
209870801,CATETER DE SUCCION NASO-FARINGEA CALIBRE 14FR LONGITUD 60CM ,0.25 ,"5,900 ","2,500 ",0 ,"8,400","2,100.00",,
209870901,CATETER DE SUCCION NASO-FARINGEA CALIBRE 16FR LONGITUD 60CM ,0.25 ,"92,900 ","31,900 ",0 ,"124,800","31,200.00",,
209871001,CATETER DE SUCCION NASO-FARINGEA CALIBRE 18FR LONGITUD 60CM ,0.25 ,"4,500 ","1,900 ",0 ,"6,400","1,600.00",,
209871201,TIJERA LAPAROSC‡PICA PARA BISTURI ARMINICO CON CONTROL MANUAL Y ALTA FRECUENCIA. SE SOLICITA VASTAGO DE 17 CM ,"1,090.00 ",0 ,0 ,0 ,0,0.00,,
