209871301,"SISTEMA DE CATERIZACION VENOSA CENTRAL DE DOBLE O TRIPLE
LUMEN CON 2 ANTIBIOTICOS (MINOCICLINA Y RIFAMPICINA), NEONATAL
O PEDIµTRICO  (SE SOLICITA DOBLE LUMEN 4FR X 5M, DE POLIURETANO)",205.00 ,0 ,0 ,0 ,0,0.00,,
209871401,"SISTEMA DE CATERIZACION VENOSA CENTRAL DE DOBLE O TRIPLE
LUMEN CON 2 ANTIBIOTICOS (MINOCICLINA Y RIFAMPICINA), NEONATAL
O PEDIµTRICO.                                                                        SE SOLICITA 5FR X 8CM, DE DOS LUMENS DE POLIURETANO",205.00 ,200 ,0 ,0 ,200,"41,000.00",,
209871501,"SISTEMA DE CATERIZACION VENOSA CENTRAL DE DOBLE O TRIPLE LUMEN CON 2 ANTIBIOTICOS (MINOCICLINA Y RIFAMPICINA), NEONATAL O PEDIµTRICO,  SE SOLICITA 5FR X 12CM, DE POLIURETANO DE DOS LUMEN.",205.00 ,"2,998 ","1,199 ",0 ,"4,197","860,385.00",,
209871601,"SISTEMA DE CATERIZACION VENOSA CENTRAL DE DOBLE O TRIPLE LUMEN CON 2 ANTIBIOTICOS (MINOCICLINA Y RIFAMPICINA), NEONATAL O PEDIµTRICO.   SE SOLICITA DE TRES LUMENES 5FR X 12CM, DE POLIURETANO",205.00 ,"1,900 ",800 ,0 ,"2,700","553,500.00",,
209871701,"SISTEMA DE CATERIZACION VENOSA CENTRAL DE DOBLE O TRIPLE LUMEN CON 2 ANTIBIOTICOS (MINOCICLINA Y RIFAMPICINA), NEONATAL O PEDIµTRICO                                                                                                                                  (SE SOLICITA 5FR X 15M, TRIPLE LUMEN DE POLIURETANO)",205.00 ,0 ,0 ,0 ,0,0.00,,
209871801,"SISTEMA DE CATERIZACION VENOSA CENTRAL DE DOBLE O TRIPLE LUMEN CON 2 ANTIBIOTICOS (MINOCICLINA Y RIFAMPICINA), NEONATAL
O PEDIµTRICO.   SE SOLICITA 5FR X 8CM, DE TRES LUMENS DE POLIURETANO",205.00 ,0 ,0 ,0 ,0,0.00,,
209871901,SISTEMA DE CATERIZACION VENOSA CENTRAL DE DOBLE   LUMEN CON 2 ANTIBIOTICOS 4FR X 8CM,205.00 ,0 ,0 ,0 ,0,0.00,,
209872001,"TUBO DE EXTENSI‡N DE VENOCLISIS. SE SOLICITA DE 25"" DE LONGITUD",0.60 ,"138,796 ","36,149 ","1,050 ","175,995","105,597.00",,
209884401,"SISTEMA CERRADO (ESPIGA) UNIDIRECCIONAL PARA EXTRACCI‡N DE SOLUCION EN BOTELLA O BOLSA, CON O SIN FILTRO DE AIRE Y CONECTOR LIBRE DE AGUJA. SE SOLICITA CON FILTRO",2.41 ,"4,400 ",0 ,0 ,"4,400","10,604.00",,
209910801,ESTIMULADOR NERVIO VAGO (PROTESIS) ,"25,783.33 ",0 ,0 ,0 ,0,0.00,,
209968301,MICROESFERAS DE POLIESTIRENO CARGADAS NEGATIVAMENTE,27.28 ,"2,215 ",196 ,0 ,"2,411","65,772.08",,
209975301,CEPILLO PLANO PARA LIMPIEZA DE 75MM X 20MM X 15MM (RIGIDO) ,25.00 ,"37,570 ","1,750 ",750 ,"40,070","1,001,750.00",,
209975501,CEPILLO PARA LIMPIAR 75mm x 20mm x 15mm (FLEXIBLE),25.00 ,"31,070 ","2,500 ",750 ,"34,320","858,000.00",,
209975701,ESPONJA TEREFTALATO DE POLIETILENO      (SE SOLICITA ESPONJA),0.90 ,"490,160 ",0 ,"44,160 ","534,320","480,888.00",,
209991001,"PELICULA DE SILICONA, CON PROTECCI‡N DE CLORHEXIDINA Y PLATA SE SOLICITA TAMA•O: 10 cm X 12 cm.",35.95 ,0 ,"2,000 ",0 ,"2,000","71,900.00",,
209991101,"PELICULA DE SILICONA, CON PROTECCI‡N DE CLORHEXIDINA Y PLATA SE SOLICITA TAMA•O: 6 cm X 20 cm.",29.50 ,0 ,"2,000 ",250 ,"2,250","66,375.00",,
209991201,"APOSITO PROTECTOR, SE SOLICITA TAMA•O 15CM X 15CM",23.38 ,"3,030 ","2,915 ",440 ,"6,385","149,249.38",,
209991301,"APOSITO PROTECTOR, SE SOLICITA TAMA•O 20CM X 20CM",37.08 ,200 ,0 ,0 ,200,"7,416.00",,
209991401,"APOSITO ESPUMA , SE SOLICITA Tama§os con borde, 12.5X 12.5 CM",33.00 ,"3,200 ",0 ,0 ,"3,200","105,600.00",,
209991501,"APOSITO ESPUMA, se solicita Tama§os sin borde 10CM X 20CM",27.00 ,"2,800 ",0 ,0 ,"2,800","75,600.00",,
209991801,"APOSITO ESPUMA , se solicita Tama§os con borde 20CMX 26CM PARA TALON.",58.60 ,"2,800 ",0 ,0 ,"2,800","164,080.00",,
209992601,ESTABILIZADOR DE CATETER SUPRA PUBICO O URETERAL,22.00 ,0 ,0 ,0 ,0,0.00,,
,Total general,**************,"131,656,187","10,160,243","4,228,616","146,045,046","111,099,262",,
,,,,,,,,,
,,,,,,,,,
